{
  "version": 1,
  "width": 128,
  "height": 128,
  "children": [
    {
      "type": "group",
      "id": "face",
      "transform": { "x": 64, "y": 64 },
      "children": [
        {
          "type": "ellipse",
          "id": "head",
          "cx": 0,
          "cy": 0,
          "rx": 48,
          "ry": 40,
          "fill": "#ffffff",
          "stroke": { "color": "#1a1a2e", "width": 2 }
        },
        {
          "type": "path",
          "id": "mouth",
          "closed": false,
          "points": [
            { "x": -12, "y": 10, "out": { "x": 6, "y": 8 } },
            { "x": 12, "y": 10, "in": { "x": -6, "y": 8 } }
          ],
          "stroke": { "color": "#1a1a2e", "width": 2 }
        }
      ]
    }
  ]
}
